{
  "agentId": "function-invocation",
  "description": "Tool invocation model for executing function calls with simple parameters",
  "models": [
    {
      "name": "qwen3.5:0.8b",
      "backend": "ollama",
      "taskApi": "chat",
      "huggingfaceId": null,
      "ollamaMinVersion": null,
      "quantization": null,
      "notes": "Ollama-compatible. Small tool-calling model."
    }
  ],
  "defaultModel": "qwen3.5:0.8b",
  "backend": "ollama",
  "taskApi": "chat",
  "ramBand": "2-4 GB",
  "gpuRequired": false,
  "recommendedVram": null,
  "cpuSafe": true,
  "defaultEnabled": true,
  "readinessTimeout": 180,
  "startupPreset": "light",
  "notes": "Default-enabled via manager no-wait. Light RAM footprint."
}
