{
  "agentId": "local",
  "description": "Tool-based workflows with local models",
  "models": [
    {
      "name": "qwen3.5:4b",
      "backend": "ollama",
      "taskApi": "chat",
      "huggingfaceId": null,
      "ollamaMinVersion": null,
      "quantization": null
    },
    {
      "name": "granite4.1:8b",
      "backend": "ollama",
      "taskApi": "chat",
      "huggingfaceId": null,
      "ollamaMinVersion": null,
      "quantization": null
    },
    {
      "name": "hermes3:8b",
      "backend": "ollama",
      "taskApi": "chat",
      "huggingfaceId": null,
      "ollamaMinVersion": null,
      "quantization": null
    }
  ],
  "defaultModel": "qwen3.5:4b",
  "backend": "ollama",
  "taskApi": "chat",
  "ramBand": "8-12 GB",
  "gpuRequired": false,
  "recommendedVram": "8 GB",
  "cpuSafe": true,
  "defaultEnabled": false,
  "readinessTimeout": 240,
  "startupPreset": "standard"
}
