{
  "agentId": "language-translation",
  "description": "Local translation models for multilingual text translation",
  "models": [
    {
      "name": "facebook/m2m100_418M",
      "backend": "transformers_seq2seq",
      "taskApi": "translation",
      "huggingfaceId": "facebook/m2m100_418M",
      "ollamaMinVersion": null,
      "quantization": null,
      "notes": "Encoder-decoder seq2seq translation model. Must use transformers pipeline, not chat completions."
    },
    {
      "name": "utter-project/EuroLLM-1.7B-Instruct",
      "backend": "vllm",
      "taskApi": "chat",
      "huggingfaceId": "utter-project/EuroLLM-1.7B-Instruct",
      "ollamaMinVersion": null,
      "quantization": null,
      "notes": "Causal instruction model. Use vLLM/SGLang or verified Ollama quantization. Translation via chat prompting."
    },
    {
      "name": "google/madlad400-3b-mt",
      "backend": "transformers_seq2seq",
      "taskApi": "translation",
      "huggingfaceId": "google/madlad400-3b-mt",
      "ollamaMinVersion": null,
      "quantization": null,
      "notes": "Encoder-decoder T5-based translation model. Safe v1 API is text-to-text translation via transformers."
    },
    {
      "name": "google/translategemma-4b-it",
      "backendModel": "translategemma:4b",
      "backend": "ollama",
      "taskApi": "translation",
      "huggingfaceId": "google/translategemma-4b-it",
      "ollamaMinVersion": null,
      "quantization": null,
      "notes": "TranslateGemma HuggingFace ID mapped to the Ollama translategemma:4b tag for Ollama-backed startup scripts."
    }
  ],
  "defaultModel": "facebook/m2m100_418M",
  "backend": "transformers_seq2seq",
  "taskApi": "translation",
  "ramBand": "2-8 GB",
  "gpuRequired": false,
  "recommendedVram": "4 GB",
  "cpuSafe": true,
  "defaultEnabled": false,
  "readinessTimeout": 120,
  "startupPreset": "translation"
}
