{
  "agentId": "coding-local",
  "description": "Agentic coding in a local repository with large local models",
  "models": [
    {
      "name": "qwen3.6:27b",
      "backend": "ollama",
      "taskApi": "chat",
      "huggingfaceId": null,
      "ollamaMinVersion": null,
      "quantization": null
    },
    {
      "name": "qwen3.6:35b",
      "backend": "ollama",
      "taskApi": "chat",
      "huggingfaceId": null,
      "ollamaMinVersion": null,
      "quantization": null
    },
    {
      "name": "granite4.1:30b",
      "backend": "ollama",
      "taskApi": "chat",
      "huggingfaceId": null,
      "ollamaMinVersion": null,
      "quantization": null
    }
  ],
  "defaultModel": "qwen3.6:27b",
  "backend": "ollama",
  "taskApi": "chat",
  "ramBand": "30-48 GB",
  "gpuRequired": false,
  "recommendedVram": "30 GB",
  "cpuSafe": false,
  "defaultEnabled": false,
  "readinessTimeout": 600,
  "startupPreset": "heavy",
  "notes": "Requires significant RAM/VRAM. CPU inference is extremely slow for 27-35B models."
}
