{
  "agentId": "adaptive-local",
  "description": "Replanning after execution and errors with large local models",
  "models": [
    {
      "name": "qwen3.5:27b",
      "backend": "ollama",
      "taskApi": "chat",
      "huggingfaceId": null,
      "ollamaMinVersion": null,
      "quantization": null
    },
    {
      "name": "granite4.1:30b",
      "backend": "ollama",
      "taskApi": "chat",
      "huggingfaceId": null,
      "ollamaMinVersion": null,
      "quantization": null
    },
    {
      "name": "qwen3.6:27b",
      "backend": "ollama",
      "taskApi": "chat",
      "huggingfaceId": null,
      "ollamaMinVersion": null,
      "quantization": null
    }
  ],
  "defaultModel": "qwen3.5:27b",
  "backend": "ollama",
  "taskApi": "chat",
  "ramBand": "24-32 GB",
  "gpuRequired": false,
  "recommendedVram": "24 GB",
  "cpuSafe": false,
  "defaultEnabled": false,
  "readinessTimeout": 600,
  "startupPreset": "heavy",
  "notes": "Requires significant RAM/VRAM. CPU inference is very slow for 27-30B models."
}
