{
  "agentId": "planning-local",
  "description": "DSL planning, reports, and specifications with local models",
  "models": [
    {
      "name": "qwen3.5:9b",
      "backend": "ollama",
      "taskApi": "chat",
      "huggingfaceId": null,
      "ollamaMinVersion": null,
      "quantization": null
    },
    {
      "name": "granite4.1:8b",
      "backend": "ollama",
      "taskApi": "chat",
      "huggingfaceId": null,
      "ollamaMinVersion": null,
      "quantization": null
    },
    {
      "name": "ministral-3:8b",
      "backend": "ollama",
      "taskApi": "chat",
      "huggingfaceId": null,
      "ollamaMinVersion": "0.6.0",
      "quantization": null,
      "notes": "Ollama page declares minimum/pre-release Ollama version."
    },
    {
      "name": "gemma4:e2b",
      "backend": "ollama",
      "taskApi": "chat",
      "huggingfaceId": null,
      "ollamaMinVersion": null,
      "quantization": null
    },
    {
      "name": "gemma4:e4b",
      "backend": "ollama",
      "taskApi": "chat",
      "huggingfaceId": null,
      "ollamaMinVersion": null,
      "quantization": null
    }
  ],
  "defaultModel": "qwen3.5:9b",
  "backend": "ollama",
  "taskApi": "chat",
  "ramBand": "12-16 GB",
  "gpuRequired": false,
  "recommendedVram": "12 GB",
  "cpuSafe": true,
  "defaultEnabled": false,
  "readinessTimeout": 300,
  "startupPreset": "standard"
}
