{
  "agentId": "function-selection",
  "description": "Specialized function/tool routing model for selecting the right function to call",
  "models": [
    {
      "name": "functiongemma",
      "backend": "ollama",
      "taskApi": "function-calling",
      "huggingfaceId": null,
      "ollamaMinVersion": "0.9.0",
      "quantization": null,
      "notes": "Ollama-native function routing model. Requires minimum Ollama version."
    }
  ],
  "defaultModel": "functiongemma",
  "backend": "ollama",
  "taskApi": "function-calling",
  "ramBand": "1-2 GB",
  "gpuRequired": false,
  "recommendedVram": null,
  "cpuSafe": true,
  "defaultEnabled": true,
  "readinessTimeout": 180,
  "startupPreset": "light",
  "notes": "Default-enabled via manager no-wait. Light RAM footprint."
}
