{
  "agentId": "validated-planning-local",
  "description": "Plans with validation and controlled repair using local models",
  "models": [
    {
      "name": "qwen3.5:9b",
      "backend": "ollama",
      "taskApi": "chat",
      "huggingfaceId": null,
      "ollamaMinVersion": null,
      "quantization": null
    },
    {
      "name": "granite4.1:8b",
      "backend": "ollama",
      "taskApi": "chat",
      "huggingfaceId": null,
      "ollamaMinVersion": null,
      "quantization": null
    },
    {
      "name": "qwen3.5:27b",
      "backend": "ollama",
      "taskApi": "chat",
      "huggingfaceId": null,
      "ollamaMinVersion": null,
      "quantization": null
    }
  ],
  "defaultModel": "qwen3.5:9b",
  "backend": "ollama",
  "taskApi": "chat",
  "ramBand": "16-24 GB",
  "gpuRequired": false,
  "recommendedVram": "16 GB",
  "cpuSafe": true,
  "defaultEnabled": false,
  "readinessTimeout": 300,
  "startupPreset": "heavy"
}
