{
  "agentId": "local-llms-manager",
  "description": "Management agent for local LLM model registration, startup script generation, and agent profile lifecycle",
  "models": [],
  "defaultModel": "",
  "backend": "ollama",
  "taskApi": "chat",
  "ramBand": "256 MB",
  "gpuRequired": false,
  "recommendedVram": null,
  "cpuSafe": true,
  "defaultEnabled": true,
  "readinessTimeout": 30,
  "startupPreset": "manager",
  "notes": "Does not serve models. MCP-only readiness. Enables function-selection and function-invocation as no-wait dependencies."
}
