{
  "agentId": "base-local",
  "description": "General writing and simple planning with local models",
  "models": [
    {
      "name": "qwen3.5:4b",
      "backend": "ollama",
      "taskApi": "chat",
      "huggingfaceId": null,
      "ollamaMinVersion": null,
      "quantization": null
    },
    {
      "name": "granite4.1:3b",
      "backend": "ollama",
      "taskApi": "chat",
      "huggingfaceId": null,
      "ollamaMinVersion": null,
      "quantization": null
    },
    {
      "name": "phi4-mini:3.8b",
      "backend": "ollama",
      "taskApi": "chat",
      "huggingfaceId": null,
      "ollamaMinVersion": null,
      "quantization": null
    },
    {
      "name": "ministral-3:3b",
      "backend": "ollama",
      "taskApi": "chat",
      "huggingfaceId": null,
      "ollamaMinVersion": "0.6.0",
      "quantization": null,
      "notes": "Ollama page declares minimum/pre-release Ollama version."
    }
  ],
  "defaultModel": "qwen3.5:4b",
  "backend": "ollama",
  "taskApi": "chat",
  "ramBand": "6-8 GB",
  "gpuRequired": false,
  "recommendedVram": "6 GB",
  "cpuSafe": true,
  "defaultEnabled": false,
  "readinessTimeout": 180,
  "startupPreset": "standard"
}
