{
  "agentId": "relevance",
  "description": "Cross-encoder reranker for passage relevance scoring",
  "models": [
    {
      "name": "Qwen/Qwen3-Reranker-0.6B",
      "backend": "reranker",
      "taskApi": "scoring",
      "huggingfaceId": "Qwen/Qwen3-Reranker-0.6B",
      "ollamaMinVersion": null,
      "quantization": null,
      "notes": "0.6B parameters, 100+ languages, 32k context. Scoring/reranking API only, not generic chat completions."
    }
  ],
  "defaultModel": "Qwen/Qwen3-Reranker-0.6B",
  "backend": "reranker",
  "taskApi": "scoring",
  "ramBand": "2-4 GB",
  "gpuRequired": false,
  "recommendedVram": "2 GB",
  "cpuSafe": true,
  "defaultEnabled": false,
  "readinessTimeout": 120,
  "startupPreset": "reranker"
}
